Título,Director,Integrantes,Estado,Tipo de proyecto,Descripción,Institución,Fecha de inicio,Fecha de finalización,Enlace,Código
"Gramática y Fonética/Fonología: Estudio de la Prosodia del Español de la Argentina (cláusulas adverbiales, marcadores y conectores, construcciones apositivas)","Borzi, Claudia Beatriz",S/D,finalizado,PIP,S/D,Instituto de Lingüística; Facultad de Filosofía y Letras; Universidad de Buenos Aires,,2015,2017,S/D
El concepto de erudición en la historia literaria hacia el siglo XIX. Continuidades y ruptura desde la modernidad,"Calvo, Florencia Nora",S/D,finalizado,PIP,S/D,"Instituto de Filología y Literatura Hispánica ""Dr. Amado Alonso""; Facultad de Filosofía y Letras; Universidad de Buenos Aires",,2015,2017,S/D
Aproximación a la problemática de los romanceamientos castellanos medievales (siglos XII -XVI): los aportes de la ecdótica y los Estudios de Traducción (Translation Studies),"Fuentes, Juan Héctor",S/D,finalizado,PIP,S/D,IIBICRIT - SECRIT; CONICET,,2015,2017,S/D
"Categorías funcionales en variedades de la Argentina: español, lenguas indígenas y variedades de contacto","Kornfeld, Laura Malena ",S/D,finalizado,PIP,S/D,Instituto del Desarrollo Humano; Universidad General Sarmiento,,2015,2017,S/D
Diacronía de lo nuevo en las comunidades letradas latinoamericanas. Textos públicos y redes en la segunda mitad del siglo XX,"Maiz, Claudio Gustavo",S/D,finalizado,PIP,S/D,Facultad de Filosofía y Letras; Universidad Nacional de Cuyo,,2015,2017,S/D
"""Fiat ars, pereat mundus"": la ""crisis de la novela"" y los ""felices años veinte"" en la Literatura Española","Minardi, Adriana Elizabeth ",S/D,finalizado,PIP,S/D,"Instituto de Filología y Literatura Hispánica ""Dr. Amado Alonso""; Facultad de Filosofía y Letras; Universidad de Buenos Aires",,2015,2017,S/D
Umbrales de la escritura: correspondencias y tensiones de la relación palabra/imagen en la literatura latinoamericana,"Puppo, María Lucía",S/D,finalizado,PIP,S/D,Departamento de Letras; Facultad de Filosofía y Letras; Pontificia Universidad Católica Argentina ,,2015,2017,S/D
"Vocabulario, narración y argumentación infantil. Un estudio psicolingüístico y sociocultural","Ronsenberg, Celia Renata ",S/D,finalizado,PIP,S/D,Centro Interdisciplianrio de Investigaciones en Psicología Matemática y Experimental Dr. Horacio Rimoldi; CONICET ,,2015,2017,S/D
"Tropos, tópicos y cartografías: figuras del espacio en la literatura latinoamericana de la Conquista a la Modernidad","Sancholuz, Carolina ",S/D,finalizado,PIP,S/D,Instituto de Investigaciones en Humanidades y Ciencias Sociales (IDIHCS); CONICET; Universidad Nacional de La Plata,,2015,2017,S/D
Prácticas de enseñanza de la escritura de la tesis de posgrado: estudio comparativo de experiencias en entornos presenciales y virtuales,"Álvarez, Guadalupe",S/D,vigente,PIP,S/D,Instituto del Desarrollo Humano; Universidad General Sarmiento,,2017,2019,S/D
"Discursos, prácticas y redes intelectuales en la cultura argentina de la primera mitad del siglo XX: nuevas intersecciones letrado-popular- masivo","Chicote, Gloria Beatriz",S/D,vigente,PIP,S/D,Instituto de Investigaciones en Humanidades y Ciencias Sociales (IDIHCS); CONICET; Universidad Nacional de La Plata,,2017,2019,S/D
Humanidades y Saber en el Renacimiento,"Ciordi, Martín José Raúl",S/D,vigente,PIP,"El objetivo de este proyecto es pensar la cuestión de los intelectuales humanistas y los saberes en el Renacimiento, a partir de una serie de casos que van desde el siglo XV al XVII, situados en Italia, Inglaterra, Francia, Portugal y España. Nuestra hipótesis de trabajo es que en todos estos casos se manifiesta una común insatisfacción con las formas de conocer y saber establecidas, que se traduce en una búsqueda de respuestas nuevas, inéditas. Así se evidencia tanto en el ""arti e scienze non udite e mai vedute"" que pregona Alberti sobre los artistas florentinos en su tratado Della pittura de 1435, como en la expresión ""em verdade lhe digo, que vi cousas que nunca vi em Europa"" del jesuita Giovanni Battista desde Japón en una epístola de 1564. Al mismo tiempo, muchas veces el carácter de novedad está paradójicamente implicado en la recuperación de formas antiguas aún en su condición de ruinas o en la revisitación creativa de los clásicos. Como parte constitutiva de esta hipótesis, afirmamos además que estos nuevos saberes pueden estar ligados a una cultura de la dominación o bien abrir un horizonte de rebelión y liberación del hombre de su servidumbre e infelicidad. Por ejemplo, en el De infelicitate principum (1440) de Poggio Bracciolini, estas dos posibilidades se encuentran encarnadas en el mismo diálogo: la primera en Cosme de Medici y la segunda, en Niccolò Niccoli. Asimismo, consideramos que investigar las maneras de saber constituye un lugar privilegiado para pensar las relaciones de poder, como en la emergencia de nuevos espacios de producción y circulación de saberes desligados de las instituciones dominantes. En línea con Bajtin, Gadamer y Ricoeur, la metodología hermenéutica que utilizaremos procura interpretar los textos atendiendo que son tanto un objeto que requiere un análisis histórico como un asunto que invita a pensar. Los resultados se materializarán y difundirán en congresos, artículos de revistas y un libro colectivo.","Instituto de Filología y Literatura Hispánica ""Dr. Amado Alonso""; Facultad de Filosofía y Letras; Universidad de Buenos Aires",,2017,2019,S/D
Archivo Lucio V. Mansilla. Para una relectura integral,"Contreras, Sandra Claudia",S/D,vigente,PIP,S/D,Instituto de Estudios Críticos en Humanidades (IECH); CONICET; Universidad Nacional de Rosario,,2017,2019,S/D
"Artes visuales, literatura y la cuestión de lo viviente: problemas y propuestas de investigación para una agenda transdisciplinaria en un campo expandido","Fernández Bravo, Álvaro ",S/D,vigente,PIP,S/D,Departamento de Humanidades; Universidad de San Andrés,,2017,2019,S/D
Letra y vida en la literatura argentina: figuraciones en primera y tercera persona,"Laera, María Alejandra ",S/D,vigente,PIP,S/D,Instituto de Literatura Hispanoamericana; Facultad de Filosofía y Letras; Universidad de Buenos Aires,,2017,2019,S/D
Trayectorias del desarrollo lingüístico de niños hablantes tardíos: Impacto de los factores individuales y sociocontextuales y análisis de la eficacia de un dispositivo de intervención temprana,"Resches, Mariela ",S/D,vigente,PIP,S/D," Centro Interdisciplianrio de Investigaciones en Psicología Matemática y Experimental ""Dr. Horacio Rimoldi""; CONICET ",,2017,2019,S/D
El debate feminista y su impacto en las artes visuales y literatura: 1960-1980. Perspectivas y desarrollo del campo cultural argentino,"Rosa, María Laura",S/D,vigente,PIP,S/D,"Instituto Interdisciplinario de Estudios de Género, Facultad de Filosofía y Letras; Universidad de Buenos Aires",,2017,2019,S/D
Teoría y crítica literarias en los ensayos tempranos de Siegfried Kracauer (1915- 1933),"Vedda, Miguel Ángel",S/D,vigente,PIP,S/D,"Instituto de Filología y Literatura Hispánica ""Dr. Amado Alonso""; Facultad de Filosofía y Letras; Universidad de Buenos Aires",,2017,2019,S/D
"Narrativa de creencias, retórica y corporalidad en contextos argentinos","Palleiro, María Inés",S/D,finalizado ,PIP,S/D,"Instituto de Filología y Literatura Hispánica ""Dr. Amado Alonso""; Facultad de Filosofía y Letras; Universidad de Buenos Aires",,2014,2016,S/D
Formas de la apariencia y el ocultamiento. Recortes del género en la cultura literaria y visual latinoamericana del presente,,"Domínguez, Nora - Szurmuk, Mónica",finalizado,PIP,S/D,Instituto de Investigación de Estudios de Género; Facultad de Filosofía y Letras; Universidad de Buenos Aires,,2015,2017,http://genero.institutos.filo.uba.ar/proyecto/formas-de-la-apariencia-y-el-ocultamiento-recortes-del-g%C3%A9nero-en-la-cultura-literaria-y
Reis Trobadors. De la investigación filológica-musicológica a la performance,"Del Río Riande, María Gimena - Rossi, Germán Pablo",S/D,finalizado,PRIG,S/D,Facultad de Filosofía y Letras; Universidad de Buenos Aires,2016,2018,S/D,S/D
Literatura política y crítica ilustrada: en torno al devenir de los lenguajes políticos en el siglo XVIII inglés,"González, Martín Pedro - Gattinoni, Andrés",S/D,finalizado,PRIG,S/D,Facultad de Filosofía y Letras; Universidad de Buenos Aires,2016,2018,S/D,S/D
"Multilingüismo, educación y nuevas tecnologías en Argentina (MENTA)","Barrios Mannara, Mariana",S/D,finalizado,PRIG,S/D,Facultad de Filosofía y Letras; Universidad de Buenos Aires,2016,2018,S/D,S/D
Relatos Libertadores. La imposición a la memoria como trauma,"Velarde, Malena - Caggi, Cecilia",S/D,finalizado,PRIES,S/D,Facultad de Filosofía y Letras; Universidad de Buenos Aires,2016,2018,S/D,S/D
Relaciones interartísticas en América Latina. Literatura y artes visuales en el siglo XX,"Alonso, Mercedes",S/D,finalizado,PRIG,S/D,Facultad de Filosofía y Letras; Universidad de Buenos Aires,2016,2018,S/D,S/D
“Hacemos hablaturas”: de ser hablados a tomar la palabra ,"Argarañaz, Úrsula - Moyano, Ana Rosa",S/D,finalizado,PRIG,S/D,Facultad de Filosofía y Letras; Universidad de Buenos Aires,2016,2018,S/D,S/D
Arquitectura Integral para algoritmo NLP de Comprensión Exhaustiva de Textos Periodísticos en Español,"Balbachan, Fernando - Carranza, Fernando",S/D,finalizado,PRIG,S/D,Facultad de Filosofía y Letras; Universidad de Buenos Aires,2016,2018,S/D,S/D
La alternancia del pronombre dativo (le/les) en esquemas ditransitivos: referencia al objeto y proceso de desentimatización,"Barbeito, Yanina - Peri, Silvina",S/D,finalizado,PRIG,S/D,Facultad de Filosofía y Letras; Universidad de Buenos Aires,2016,2018,S/D,S/D
"Cartografía de lo ominoso. Palabras e imágenes para pensar lo inefable (Argentina, c. 1983 - 2003)","Bertúa, Paula - Cobas Carral, Andrea Isabel",S/D,finalizado,PRIG,S/D,Facultad de Filosofía y Letras; Universidad de Buenos Aires,2016,2018,S/D,S/D
"Las letras del rock en Argentina después del 2001
","Blanco, Oscar - Scaricaciottoli, Emilio",S/D,finalizado,PRIG,S/D,Facultad de Filosofía y Letras; Universidad de Buenos Aires,2016,2018,S/D,S/D
"Cruce-cruzamento: diálogo, debates e intercambios entre Argentina y Brasil","Cabezas, Laura - Penacini, Constanza",S/D,finalizado,PRIG,S/D,Facultad de Filosofía y Letras; Universidad de Buenos Aires,2016,2018,S/D,S/D
Entre el silencio debido y la voz impuesta. La imagen de la mujer en los discursos de la conquista americana y su reinvención desde la literatura moderna,"Cameroni, Lara - Darchez, Amedeo",S/D,finalizado,PRIES,S/D,Facultad de Filosofía y Letras; Universidad de Buenos Aires,2016,2018,S/D,S/D
Mundos ficcionales: de la teoría literaria a la teoría de ficción,"Campos, María Guadalupe - Vila, Ezequiel ",S/D,finalizado,PRIG," Nuestro objetivo principal consiste en continuar nuestra investigación (iniciada con el PRI 2012 “La teoría de los mundos posibles y sus relaciones con la ficción”) acerca las teorías de la ficción, específicamente aquellas que contribuyen a desarrollar el concepto de “mundo ficcional”. Desde nuestra perspectiva, estas teorías permiten aproximarse a los fenómenos transmediales con herramientas de análisis que superan las limitaciones del “textualismo” habituales, sino constitutivas, de las principales corrientes de la teoría literaria. Además, el uso de estas categorías permite pensar nuevos cruces entre problemas filosóficos y estudios literarios, en la medida en que reflexionan sobre la ontología de los objetos ficcionales. Nos proponemos volcar los resultados de nuestras investigaciones en un volumen que sirva tanto para la divulgación del enfoque en cuestión como realice contribuciones originales en el ámbito de las teorías de la ficción. También, como en previas ocasiones, prevemos contribuir con la transferencia de este marco teórico y metodológico dictando cursos de extensión y jornadas en la Facultad de Filosofía y Letras de la UBA. ",Facultad de Filosofía y Letras; Universidad de Buenos Aires,2016,2018,S/D,S/D
"Relaciones interartísticas en el modernismo latinoamericano (1880 - 1920): viajes, traducciones, lenguajes","Caresani, Rodrigo - Olijnik, María Julia",S/D,finalizado,PRIG,S/D,Facultad de Filosofía y Letras; Universidad de Buenos Aires,2016,2018,S/D,S/D
"Reseñas on-line de textos académicos como material de lectura estudiantes de alemán-lectocomprensión
","Fernández Polcuch, Martina - Aren, Fernanda",S/D,finalizado,PRIG,S/D,Facultad de Filosofía y Letras; Universidad de Buenos Aires,2016,2018,S/D,S/D
"La lecto-comprensión en italiano en la FFyL. Experiencias de lectura cooperativa en situaciones de estudio
","Fernández Speier, Claudia",S/D,finalizado,PRIG,S/D,Facultad de Filosofía y Letras; Universidad de Buenos Aires,2016,2018,S/D,S/D
Las relaciones sintácticas entre cláusulas desde el Enfoque Cognitiva - Prototípico,"Funes, María Soledad - Poggio, Anabella",S/D,finalizado,PRIG,S/D,Facultad de Filosofía y Letras; Universidad de Buenos Aires,2016,2018,S/D,S/D
Cristóbal Colón y Oriente (1492 - 1506): literatura de viajes y estudios culturales,"Garzón Mantilla, Juan Carlos",S/D,finalizado,PRIG,S/D,Facultad de Filosofía y Letras; Universidad de Buenos Aires,2016,2018,S/D,S/D
Plan de estudios de la carrera de Letras (1966 - 2016),"Lacalle, Juan Manuel - Constantino, Enzo",S/D,finalizado,PRIG,S/D,Facultad de Filosofía y Letras; Universidad de Buenos Aires,2016,2018,S/D,S/D
 La cuestión romántica. Bibliografías y debates,"Ledesma, Pablo Jerónimo - Rodríguez Baigorria, Martín",S/D,finalizado,PRIG,S/D,Facultad de Filosofía y Letras; Universidad de Buenos Aires,2016,2018,S/D,S/D
Traducción y contexto. La traducción del ruso al español y su contexto de producción y recepción,"López Arriazu, Eugenio - Lobos, Omar. ",S/D,finalizado,PRIG,S/D,Facultad de Filosofía y Letras; Universidad de Buenos Aires,2016,2018,S/D,S/D
Materiales para enseñanza de la variedad lingüística en la clase de lengua y literatura (nivel primario),"López García, María - Boborino, María Paula",S/D,finalizado,PRIG,S/D,Facultad de Filosofía y Letras; Universidad de Buenos Aires,2016,2018,S/D,S/D
Figuras de letrado en la prensa de la primera mitad del siglo XIX americano,"Martínez Gramuglia, Pablo",S/D,finalizado,PRIG,S/D,Facultad de Filosofía y Letras; Universidad de Buenos Aires,2016,2018,S/D,S/D
"La cuestión romántica. Bibliografía y debates.
","Ledesma, Pablo - Rodríguez Baigorria, Martín.",S/D,finalizado,PRIG,S/D,Facultad de Filosofía y Letras; Universidad de Buenos Aires,2016,2018,S/D,S/D
Materiales para la enseñanza de la variedad lingüística en la clase de lengua y literatura (nivel primario),"López García, María - Boborino, María Paula",S/D,finalizado,PRIG,S/D,Facultad de Filosofía y Letras; Universidad de Buenos Aires,2016,2018,S/D,S/D
El nominal en la Lengua de Señas Argentina (LSA). Un estudio desde el Enfoque Cognitiva Prototípico,"Martínez, Rocío - Morón Unsadivaras, Mariana ",S/D,finalizado,PRIG,S/D,Facultad de Filosofía y Letras; Universidad de Buenos Aires,2016,2018,S/D,S/D
Historia institucional de la carrera de Letras,"Migliore, María José - Caballero Vieytes, Bárbara",S/D,finalizado,PRIG,S/D,Facultad de Filosofía y Letras; Universidad de Buenos Aires,2016,2018,S/D,S/D
Cuerpo presente. Enfermedad y muerte en la literatura y las artes visuales argentinas y latinoamericanas contemporáneas,"Montes, Alicia - Ares, María Cristina",S/D,finalizado,PRIG,S/D,Facultad de Filosofía y Letras; Universidad de Buenos Aires,2016,2018,S/D,S/D
Entre oralidad y escritura: una mirada comparativa sobre sus orígenes y desarrollo,"Nuñez, Nathalie",S/D,finalizado,PRIG,S/D,Facultad de Filosofía y Letras; Universidad de Buenos Aires,2016,2018,S/D,S/D
 Género - Género. Educación - Reproducción Filología - Posteoría,"Palacios, Jimena - Usuca, Noel",S/D,finalizado,PRIG,S/D,Facultad de Filosofía y Letras; Universidad de Buenos Aires,2016,2018,S/D,S/D
"Historia de la propiedad literaria en la Argentina. Antecedentes, discusiones y fundamentos
","Raia, Matías - Heidel, Evelin",S/D,finalizado,PRIG,S/D,Facultad de Filosofía y Letras; Universidad de Buenos Aires,2016,2018,S/D,S/D
"Lecturas de la sincronía: literaturas latinoamericanas y poesía de los 90
","Rodríguez Baigorria, Martín Carlos",S/D,finalizado,PRIG,S/D,Facultad de Filosofía y Letras; Universidad de Buenos Aires,2016,2018,S/D,S/D
Hacia una caracterización del estilo biográfico de Cornelio Nepote: traducción y análisis textual,"Sapere, Analía Melone, Juan",S/D,finalizado,PRIG,S/D,Facultad de Filosofía y Letras; Universidad de Buenos Aires,2016,2018,S/D,S/D
Materialidades discursivas y políticas editoriales del libro en la Argentina (2000-2015),"Tosi, Carolina",S/D,finalizado,PRIG,S/D,Facultad de Filosofía y Letras; Universidad de Buenos Aires,2016,2018,S/D,S/D
 La arquitectura de la Facultad del Lenguaje: Relación entre el Sistema Computacional y otros componentes de la Gramática,"Sitgliano, Laura - Trebisacce, Romina",S/D,finalizado,PRIG,S/D,Facultad de Filosofía y Letras; Universidad de Buenos Aires,2016,2018,S/D,S/D
Lo femenino en los dos miles: coming of age y construcción de la subjetividad femenina en el siglo XXI,"Villafañe, María ",S/D,finalizado,PRIG,S/D,Facultad de Filosofía y Letras; Universidad de Buenos Aires,2016,2018,S/D,S/D
"El erotismo y la sexualidad en la literatura francesa libertina del siglo XVIII
","Zorrilla, Natalia - de la Vega, María",S/D,finalizado,PRIG,S/D,Facultad de Filosofía y Letras; Universidad de Buenos Aires,2016,2018,S/D,S/D
Retraso y alteraciones en el desarrollo del lenguaje oral. Implicancias para la alfabetización inicial: estrategias de trabajo en el espacio del aula,"Zunino, Gabriela Mariel - Casajús, Andrea",S/D,finalizado,PRIG,S/D,Facultad de Filosofía y Letras; Universidad de Buenos Aires,2016,2018,S/D,S/D
"Retórica y oratoria clásicas: sistematización, aplicación y proyecciones en el discurso político contemporáneos","Daujotas, Gustavo - Radiminski, Marisel",S/D,finalizado,PRIG,S/D,Facultad de Filosofía y Letras; Universidad de Buenos Aires,2016,2018,S/D,S/D
El archivo como política de lectura. Reformulaciones teóricas y metodológicas en América Latina acerca de archivos y manuscritos,"Goldchluk, Graciela Beatriz",S/D,vigente,PICT,S/D,Universidad de la Plata; Agencia Nacional de Promoción Científica y Tecnológica ,2015,2019,S/D,PICT-2015- 0743
La historiografía de la cultura literaria latinoamericana a través de las redes intelectuales,"Maíz, Claudio Gustavo",S/D,vigente,PICT,S/D,Universidad Nacional de Cuyo; Agencia Nacional de Promoción Científica y Tecnológica ,2015,2019,S/D,PICT-2015- 0477
La Naturaleza en la Literatura Latina. El campo semántico de Natura y sus funciones textuales: caracterización y dinámica de res,"Galán, Lía Margarita",S/D,vigente,PICT,S/D,Universidad Nacional de la Plata; Agencia Nacional de Promoción Científica y Tecnológica ,2015,2019,S/D,PICT-2015- 2035
Tecnologías de papel. Patrones para la documentación y comunicación científica en los estudios de lenguas indígenas de Patagonia,"Malvestitti, Liliana Marisa",S/D,vigente,PICT,S/D,Universidad Nacional de Río Negro; Agencia Nacional de Promoción Científica y Tecnológica ,2015,2019,S/D,PICT-2015- 1507
Las publicaciones periódicas como contextos formativos de la literatura argentina (siglo XX),"Rogers, Geraldine",S/D,vigente,PICT,S/D,Universidad Nacional de La Plata; Agencia Nacional de Promoción Científica y Tecnológica ,2015,2019,S/D,S/D
La comunidad discursiva del Archivo de la Dirección de Inteligencia de la Policía de la Provincia de Buenos Aires (DIPBA),"Vitale, María Alejandra","
Dagatti, Mariano
Chiavarino, Nicolás Alejandro
Magnanego, Florencia
Bettendorff, María Elsa",vigente,PICT,"El archivo de la Dirección de Inteligencia de la Policía de la Provincia de Buenos Aires (DIPBA), creada en 1956 (con herencia de legajos de anteriores dependencias de ""orden social y político"", fechados desde 1932) y disuelta en 1998, es usado en la actualidad en especial como fuente que contribuya a políticas de reparación a las víctimas del Terrorismo de Estado y como registro probatorio en las causas judiciales contra quienes cometieron delitos de lesa humanidad. Asimismo, es empleado como fuente documental por historiadores, quienes a partir de la apertura de su consulta pública en 2003 han reflexionado -como se ha hecho también desde la sociología y la antropología social- sobre su relación con la conformación de la memoria colectiva. Hasta el momento, ninguna investigación ha abordado dicho archivo desde el marco del análisis del discurso, salvo la iniciada por integrantes de este Equipo de Trabajo mediante un Proyecto UBACyT, que no contempló el estudio del material icónico ni multimodal preservado en el Archivo de la DIPBA. En este sentido, este Proyecto formula que una comunidad discursiva incluye un régimen escópico, lo que no ha sido considerado con anterioridad por el análisis del discurso. Este Proyecto propone así un primer estudio que indague el Archivo DIPBA como comunidad discursiva mediante el análisis de los dispositivos genéricos, el ethos y su antiethos u otro, su régimen escópico y la memoria discursiva. En efecto, como objetivos específicos plantea: a. Caracterizar los géneros discursivos empleados por el grupo productor del archivo DIPBA. b. Describir el ethos de quienes practicaron el espionaje político-ideológico, incluyendo sus opiniones sobre el cine, el teatro, la literatura y la construcción de su antiethos u otro (contemplados los estudiantes, los sindicalistas y la comunidad antifranquista española en la Argentina). c. Describir la memoria discursiva que opera en los discursos producidos por este grupo. d. Caracterizar el régimen escópico inherente al grupo productor del archivo DIPBA. e. Contrastar la construcción del ethos, sus opiniones sobre el cine, la literatura y su antiethos u otro (incluidos los estudiantes, los sindicalistas y la comunidad antifranquista española en la Argentina), los géneros discursivos empleados, el régimen escópico y la memoria discursiva en relación con las diversas condiciones de producción del archivo de la DIPBA, en particular la alternancia entre democracia y dictadura.",Instituto de Lingüística; Facultad de Filosofía y Letras; Universidad de Buenos Aires; Agencia Nacional de Promoción Científica y Tecnológica ,2017,2020,http://il.institutos.filo.uba.ar/proyecto/la-comunidad-discursiva-del-archivo-de-la-direcci%C3%B3n-de-inteligencia-de-la-polic%C3%ADa-de-la,PICT- 2015/3712
Perspectivas de la performance en la Grecia Antigua. Contextos culturales para la transmisión poética de la memoria cultural,"Torres, Daniel Alejandro",S/D,finalizado,PICT,S/D,Universidad de Buenos Aires; Agencia Nacional de Promoción Científica y Tecnológica ,2015,S/D,S/D,PICT-2015- 0799
La traducción y glosa de la Divina Comedia (1515) en el marco de la literatura apologética del reinado de los Reyes Católicos,"Hamlin, cinthia",S/D,finalizado,PICT,S/D,Consejo Nacional de Investigaciones Científicas y Técnicas; Agencia Nacional de Promoción Científica y Tecnológica ,2015,S/D,S/D,PICT-2015- 1935
Funciones institucionales y políticas intelectuales en la crítica literaria y cultural argentina (1910-2010),"Crespi, Gerardo Maximiliano",S/D,finalizado,PICT,S/D,Universidad Nacional de La Plata; Agencia Nacional de Promoción Científica y Tecnológica ,2015,S/D,S/D,PICT-2015- 1630
"Proyectos transtemporales: narrativas de larga duración en la literatura, el teatro y el cine argentinos ","Contreras, Sandra Claudia",S/D,finalizado,PICT,S/D,Universidad Nacional de Rosario; Agencia Nacional de Promoción Científica y Tecnológica ,2017,S/D,S/D,PICT-2017- 2339
El enfoque dialógico de la argumentación y de la polifonía. Un modelo semántico-pragmático para el análisis de la subjetividad ,"García Negroni, María Marta",S/D,S/D,PICT,S/D,Universidad de Buenos Aires; Agencia Nacional de Promoción Científica y Tecnológica ,2017,S/D,S/D,PICT-2017- 2942
Términos críticos y palabras clave en la literatura latinoamericana," Colombi, Beatriz","Teglia, Vanina -
Ruiz, Facundo -
Aldao, María Inés - Caresani, Rodrigo -
Rosetti, Mariana -
Añón, Valeria - Schnirmajer, Ariela ",vigente,PICT,S/D,"Instituto de Literatura Hispanoamericana; Facultad de Filosofía y Letras; Universidad de Buenos Aires;
 Agencia Nacional de Promoción Científica y Tecnológica ",2015,2019,http://ilh.institutos.filo.uba.ar/proyecto/t%C3%A9rminos-cr%C3%ADticos-y-palabras-clave-en-la-literatura-latinoamericana,PICT- 2014-3218
La narrativa en el Bizancio temprano (ss. IV-IX),"Cavallero, Pablo",S/D,S/D,PICT,S/D,Universidad de Buenos Aires,S/D,S/D,S/D,PICT-2017- 0387
Las relaciones interoracionales en la gramática y en el texto,"Gianmmatteo, Graciela Mabel ",S/D,S/D,PICT,S/D,Universidad de Buenos Aires,S/D,S/D,S/D,PICT-2017- 0434
