Título,Director,Integrantes,Estado,Tipo de proyecto,Descripción,Institución,Fecha de inicio,Fecha de finalización,Enlace,Código
Fuentes antiguas y medievales en la fundación de la historiografía moderna castellana: el caso de Lorenzo de Padilla,"Saracino, Pablo",S/D,vigente,UBACYT,"Durante el reinado de Carlos V, España, ya en su plena etapa imperial, impulsa un nuevo proyecto historiográfico bajo lineamientos ideológicos tendientes a aportar al reino un status equivalente al de otras potencias europeas, como Francia, Italia, Alemania, Inglaterra. Los elementos fundantes de dicho relato harán especial hincapié en la historia religiosa de las poblaciones de la Península (primeros mártires y predicación del apóstol Santiago) y la vinculación con las antiguas civilizaciones de Grecia y Roma. En este sentido, ingresarán dentro del interés de los principales historiadores multiplicidad de registros arqueológicos, muchos de los cuales habrán de ser exhumados en el proceso mismo de investigación histórica que la redacción de las crónicas requiere. Gran cantidad de documentación, fuentes documentales e historiográficas oportunamente citadas en el texto completan un corpus de materiales a través de los cuales la producción del período funda las bases de un incipiente método moderno de investigación historiográfico, en el cual las tradicionales fuentes antiguas y medievales hallarán su fundamentación (o acaso su refutación) a través de los datos que esta nueva información heterogénea proporciona. Esta ""inuentio"" (descubrimiento) de la Historia hallará su correlato en el uso frecuente de fuentes apócrifas a las cuales se les atribuyen datos de máxima incumbencia para la identidad hispana y de carácter plenamente legendario. Así la ""inuentio"" y la ?invención? articulan el entramado narrativo ideológico sobre el cual habrá de fundar su legitimación el imperio español. El caso de la Primera parte de las Crónicas de España de Lorenzo de Padilla -obra inédita de la cual el presente proyecto pretende brindar una edición crítica- representa un caso pionero en esta innovadora metodología de objetivos amplios y abarcadores de la totalidad de la diversidad histórica y cultural del reino de España. La relación entre historia, narración (relato) e ideología será el marco teórico dentro del cual el texto trabajado será interrogado.",Facultad de Filosofía y Letras; Universidad de Buenos Aires,2018,2020,S/D,20020170200044BA
Silvestris Musa: el discurso y sus cartografías en Roma,"Schniebs, Alicia Noemí",S/D,vigente,,"Este proyecto se propone analizar las características y funciones de los esquemas discursivos sostenidos implícita o explícitamente por nociones o representaciones espaciales en un corpus integrado por diversos géneros y autores de la literatura latina del período comprendido entre los siglos III a.C. y II de nuestra era. Se procura dar cuenta de: a) la base cognitiva aportada por las categorías espaciales, b) la interacción de estas categorías con el resto de los elementos de la serie literaria, y c) los aspectos particulares de la construcción de un proceso metafórico basado en la espacialidad. La propuesta es continuación del proyecto actualmente en curso: ?Lugares en tensión: formas y funciones de la representación espacial en Roma? (programación 2014-2017), en cuyo transcurso detectamos que en los modos de decir el espacio intervienen una serie de matrices e imaginerías, que involucran lugares, objetos, acciones y actores, y que se reiteran una y otra vez en los textos más allá de su especificidad genérica y su contexto de producción. Sostenemos que estas cadenas de recurrencia constituyen un repertorio finito de cartografías, que se inscriben en la enciclopedia compartida por emisores y destinatarios, operan como elementos macro y microtextuales,  e implican posicionamientos respecto de la obra que los contiene, del campo literario y del contexto de producción.",Facultad de Filosofía y Letras; Universidad de Buenos Aires,2018,2020,S/D,20020170100162BA
Historia y historiografía de la literatura y el cine policiales argentinos,"Setton, Roman","Pignatiello, Gerardo - Capusotto, Natalia - Fernández, Carolina - Debussy, Pablo - Maltz, Hernán - Pérez, María Laura - Moneta, Leticia - Vogelfang, Lucía - Vilariño, Andrea",vigente,UBACYT,"El proyecto es una continuación de nuestras investigaciones precedentes sobre la historia de la literatura y el cine policiales argentinos a la luz de los modelos genéricos alemanes, franceses, ingleses y estadounidenses . En este proyecto nos proponemos proseguir con el estudio comparativo y extenderlo ahora a toda la historia de ese género en la literatura y el cine argentinos. Se busca indagar de qué modo y con qué entonaciones particulares se desarrolla progresivamente lo policial en la Argentina, incorporando elementos de otras tradiciones y transformándolos en parte según las propias peculiaridades de los conflictos y las tradiciones locales.El presente proyecto se propone así revisar la historia del género policial en la Argentina tanto en la tradición literaria como en la cinematográfica y poner en discusión la visión hegemónica des estas historias.",Facultad de Filosofía y Letras; Universidad de Buenos Aires,2018,2019,http://iflh.institutos.filo.uba.ar/proyecto/historia-y-historiograf%C3%ADa-de-la-literatura-y-el-cine-policiales-argentinos,20020170200125BA
Mores maiorum y libertas como ejes de análisis de los textos satíricos de Roma: estrategias de supervivencia político-sociales,"Steinberg, María Eugenia",S/D,vigente,UBACYT,"El presente proyecto se configura como una continuación y profundización del actualmente en curso (0768 2014-2017  ?Sátira latina y metatextos: resignificar lo fragmentario desde los transmisores indirectos hasta Lucilio?) en el que nos propusimos editar con comentarios los fragmentos en una  edición de los siete primeros libros de Lucilio satírico. Para el proyecto UBACyT 2018 giramos la perspectiva de análisis a aspectos determinantes de la literatura en Roma la cual en general tiende a consolidar la preeminencia de las grandes familias con su difusión, a partir de los mores maiorum (costumbres de los antepasados) y la libertas (fundamentalmente libertad de palabra) que sustentan el poder político y a la vez son ejes que consolidan los comportamientos sociales de la población.En manos de los poetas satíricos, los mores maiorum y la libertas funcionan como ejes que determinan la supervivencia del poeta crítico y cómico: este se basa en vicios y virtudes en un discurso que, desde el punto de vista retórico, podría considerarse epidíctico en sus aspectos de vituperación y consejo o advertencia. Los mores maiorum o costumbres de los antepasados constituyen una de las bases de sustentación de la res publica. Allí donde las bases se alteran, se invierten o se añoran por la ausencia, cabe ubicar el discurso satírico, un discurso cargado de poder y en esa medida la persona que asume el satírico puede representar distintas estrategias de supervivencia frente al poder representado por la auctoritas política de los magistrados.El individuo amenzado por la crítica del satírico buscará defenderse de la invectiva, el objetivo de ataque de los procedimientos satíricos.  Cada uno de los cuatro poetas satíricos en verso de Roma enfoca sus objetivos y sus motivos con estrategias de supervivencia políticas, en tanto morales, y sociales de manera diferente y con una serie de modificaciones de la persona satírica en las etapas compositivas.A estas hipótesis de trabajo conduce el trabajo sobre los restantes libros de fragmentos de Lucilio como para completar la edición de los fragmentos conservados, no incluidos en el resultado del Proyecto en curso (2014-2017). El corpus de análisis se basa en los fragmentos de Lucilio, y las sátiras de Horacio, Persio y Juvenal También se incluyen los autores de sátira menipea, lo spoudogéloion, el prosimetrum, el epigrama y otros textos cómicos con rasgos  satíricos de prédica e invectiva como corpus de contrastación.",Facultad de Filosofía y Letras; Universidad de Buenos Aires,2018,2020,S/D,20020170100559BA
Hecyra de Terencio: entre la sorpresa y la reinvención. Relectura y traducción anotada,"Suárez, Marcela",S/D,vigente,UBACYT,"El presente proyecto se propone llevar a cabo una relectura y una traducción de Hecyra que, sobre la base de los nuevos abordajes teóricos, implique un acercamiento a la obra desde distintos ejes de análisis (contexto sociohistórico, modo de funcionamiento del acontecimiento teatral, humor y formas de comicidad, entre otros) que permitan reubicarla en el corpus terenciano y en el conjunto de la comedia palliata como la comedia en la que Terencio juega con lo trillado a partir de la sorpresa y la reinvención.",Facultad de Filosofía y Letras; Universidad de Buenos Aires,2018,2020,S/D,20020170100324BA
"Textos fundacionales, narrativas funcionales: Chile y Río de la Plata","Tieffemberg, Silvia ",S/D,vigente,UBACYT,"El proyecto estará articulado en dos etapas de diferente extensión: en primer lugar nos proponemos considerar, a partir del análisis contrastivo-comparativo de un conjunto de textos tempranos de las conquistas de Chile y Río de la Plata -escasamente estudiados por la crítica especializada-, las resultantes retórico-narrativas de la urgencia por descubrir yacimientos auríferos o ciudades imaginarias, tanto como de la necesidad de comprender/ dominar el nuevo territorio y los actores sociales intervinientes, dentro del horizonte de posibilidades que habilitaba el repertorio de conceptualizaciones clásicas y medievales, y las surgidas del mismo hecho colonial. En este sentido, tendremos en cuenta el surgimiento de un discurso fundacional bifronte en el que conviven la narración del hambre y la antropofagia con la prodigalidad de un espacio donde las amazonas toman sus alimentos en vajilla de oro. El corpus en esta primera etapa contemplará textos escritos en la primera mitad del siglo XVI de los actuales territorios de Chile y Río de la Plata: desde 1525, con los primeros relatos surgidos en torno a las expediciones de Solís y Gaboto, hasta 1558, cuando se escribe la primera crónica chilena que tiene como figura central a Pedro de Valdivia, período que coincide con la llegada de la expedición de Cabeza de Vaca y el descubrimiento de la inexistencia de tesoros en el Río de la Plata. Narrativas estas que podemos denominar fundacionales, que dieron cuenta de un espacio antes imaginado que conocido y generaron discursos funcionales, tanto para que la metrópolis convirtiera en objeto de deseo el lejano sur de las nuevas tierras y destinara recursos, como para que la propia hueste se cohesionara alrededor de las quimeras del oro o la fuente de la juventud eterna. Ahora bien, estas narrativas fundacionales fueron revisitadas en el siglo XX y generaron tanto en Chile como en Argentina, nuevos discursos, funcionales a otros contextos históricos. De manera que, en una segunda etapa el proyecto propone reflexionar sobre el modo en que los documentos coloniales estudiados en la primera etapa se resignificaron y refuncionalizaron, en un corpus de ensayos, textos de ficción, revistas y libretos de teatro lírico de Chile y Argentina, atendiendo al 'espíritu' que unía las conmemoraciones del IV Centenario del 'Descubrimiento de América' y las independencias de ambos países, y las fundaciones de Santiago y Buenos Aires.",Facultad de Filosofía y Letras; Universidad de Buenos Aires,2016,2018,S/D,20020150100117BA
"Literatura, Estado y Nación: hacia un nuevo comparatismo hispánico","Topuzian, Marcelo","
Rigoni, Mirtha - Di Salvo, Lucía - Beviglia, Vanina - Girasole, María Belén - Tejero Yosovitch, Yael - Maradei, Guadalupe - Jersonsky, Eva - Muiños, Camila - Chalian, Marisol - Mosquera, Mariano - Ruiz López, Tomás - Minardi, Adriana - Minguzzi, Armando - Lamarca, Sofía - Brina, Maximiliano - Sólimo, Laura - Mendoza, Juan José- Buchbinder, Agustina - Samoilovich, Lara - López, Rodrigo - Salaverría, Leonor - Montes, Alicia",vigente,UBACYT,"En continuidad con proyectos anteriores, nos proponemos estudiar las relaciones entre literatura, Estado y política, en el marco de los debates contemporáneos acerca de la nación y en un corpus de autores y textos españoles y latinoamericanos. Tras estudiar los retos que la literatura mundial y los nuevos comparatismos oponen al paradigma de la historiografía de las literaturas nacionales, ahora revisaremos la participación de la literatura entre los dispositivos de gubernamentalidad estatal en formas que excederían el modelo proporcionado por las historias de formación de las culturas nacionales. Es nuestra hipótesis que una rehabilitación de la pregunta por excelencia de la teoría literaria acerca de la literatura podría desentramar los vínculos culturales rígidos entre literatura, Estado y nación, para evidenciar modos alternativos de legitimación de lo común. La 'capilaridad' de las intervenciones del Estado hace que la distinción misma de Estado y sociedad, de cuya contraposición rígida dependen gran parte de las definiciones sociológicas de la literatura, resulte conflictiva: el énfasis en 'lo social' de la literatura invisibiliza cómo ella se constituye también como una institución del Estado -y no solo como encarnación de una nación a partir de su caracterización en términos identitarios. Por otro lado, es necesario cuestionar la comprensión unívoca del rol de mediación cultural de la literatura a partir de la noción modernista de medio literario específico, dominado por el imaginario excluyente que opone la 'lengua nacional' a su negación-abstracción internacionalista y cosmopolita. De ser ciertas nuestras ideas acerca de la intervención de la literatura en la mediatización de las relaciones sociales, nos encontraríamos ante una propuesta superadora en los recientes debates acerca del comparatismo en literatura a partir de un análisis material de la medialidad literaria. Así, volvería a ser pertinente estudiar la literatura en su potencia de inmediatización, de generación de experiencias inmersivas de lectura y sustracción radical respecto de su constitución medial material. Esto permitirá desplegar una reflexión sobre una configuración posible de los mundos literarios ya no dependiente de una teoría general del medio ficcional y capaz de incorporar los cruces y mezclas impuestos por una concepción comparatista y trasnacional radical de la literatura y la lectura.","Instituto de Filología y Literatura Hispánica ""Dr. Amado Alonso""; Facultad de Filosofía y Letras; Universidad de Buenos Aires;",2018,2020,http://iflh.institutos.filo.uba.ar/proyecto/literatura-estado-y-naci%C3%B3n-hacia-un-nuevo-comparatismo-hisp%C3%A1nico,20020170100240BA
"El ensayo alemán durante el ""período artístico"" (Kunstperiode) y durante el nazismo: afinidades, correspondencias, controversias","Vedda, Miguel Ángel","Belforte, María - Burello, Marcelo - Castano, María Belén - Castel, María - Ferrari, Mariela - García Chicote, Francisco - Koval, Martín - Labado, Silvia - Marando, Guadalupe - Martedi, Olga - Pivetta, Carola - Ruiz, Esteban - Salinas, Martín - Setton, Roman - Sufotinski, Tomás",vigente,UBACYT,"La finalidad del proyecto es examinar la peculiaridad de la producción ensayística correspondiente 1) al período clásico y romántico de la literatura alemana, 2) a la época de la Segunda Guerra Mundial. Además de estudiar las líneas fundamentales de desarrollo del ensayo en las épocas indicadas, se tratará de establecer una comparación entre ambas; un punto central del análisis consistirá en examinar los modos en que los principales ensayistas de lengua alemana - en su mayoría, exiliados- procuraron apropiarse del legado literario del período clásico y romántico (o, eventualmente, revisarlo y cuestionarlo) en el contexto de un enfrentamiento con la política cultural del régimen nazi.","Instituto de Filología y Literatura Hispánica ""Dr. Amado Alonso""; Facultad de Filosofía y Letras; Universidad de Buenos Aires;",2018,2020,http://iflh.institutos.filo.uba.ar/proyecto/el-ensayo-alem%C3%A1n-durante-el-per%C3%ADodo-art%C3%ADstico-kunstperiode-y-durante-el-nazismo-afinidades,20020170100083BA
Contextos de performance en la Grecia Antigua: espacios de recuperación y retransmisión del pasado en la literatura griega desde la época Arcaica hasta la época Imperial.,"Torres, Daniel",S/D,vigente,UBACYT,"El presente proyecto se presenta como continuidad de la investigación iniciada en el PIP-CONICET: ?La configuración de la gramática escolar argentina (1863-1922)?, desarrollado hasta 2016, y aspira a avanzar en el trazado de una historia de la gramática escolar argentina desde la primera legislación existente (1863, decreto fundacional del Colegio Nacional de Buenos Aires) hasta la creación del Instituto de Filología de la Universidad de Buenos Aires (1922).El proyecto comprende dos etapas: en la primera, de base documental, pretendemos finalizar con la tarea iniciada en la investigación arriba mencionada con el fin de delimitar y establecer un corpus que incluya el conjunto de los textos gramaticales producidos en la Argentina durante el período considerado. Como resultado de esta etapa, aspiramos a elaborar un catálogo de las gramáticas escolares publicadas entre 1863 y 1922, que comprenda también la edición digital de las más representativas. Esta fase servirá como insumo de una segunda etapa, analítica e interpretativa, que buscará determinar de qué modo se ha configurado la reflexión gramatical en el ámbito escolar argentino.En el ámbito de la historiografía lingüística hispánica, existen numerosas investigaciones sobre la gramaticografía didáctica decimonónica. No obstante, la mayor parte de ellas se ha ocupado de abordar obras o autores particulares, mientras que todavía existen pocos estudios que aporten una perspectiva más amplia sobre un período determinado o sobre un conjunto específico de autores. Esta desatención redunda en un desconocimiento de numerosos aspectos de la historia gramatical y escolar argentina que podrían resultar determinantes para la comprensión global de muchos fenómenos actuales, tanto en el campo de la lingüística como en el de la didáctica de la lengua. Estudios recientes demuestran que las ideas gramaticales contenidas en los manuales escolares han producido importantes beneficios a la lingüística contemporánea; por ejemplo, el de servir de transmisoras de la ?alta? producción teórico-científica que se desarrolla en el seno de las diferentes corrientes lingüísticas.A partir de esta perspectiva, esperamos que nuestra investigación aporte a la recuperación documental de la tradición gramatical, contribuya a determinar el modo en que esta se interrelaciona con las teorías lingüísticas contemporáneas y se constituya en un aporte a la reflexión sobre las prácticas actuales de la enseñanza de la lengua.",Facultad de Filosofía y Letras; Universidad de Buenos Aires,2018,2020,S/D,20020170100324BA
Los inicios de la gramática escolar en la Argentina (1863-1922),"Toscano y García, Guillermo",S/D,vigente,UBACYT,"El presente proyecto se presenta como continuidad de la investigación iniciada en el PIP-CONICET: ?La configuración de la gramática escolar argentina (1863-1922)?, desarrollado hasta 2016, y aspira a avanzar en el trazado de una historia de la gramática escolar argentina desde la primera legislación existente (1863, decreto fundacional del Colegio Nacional de Buenos Aires) hasta la creación del Instituto de Filología de la Universidad de Buenos Aires (1922).El proyecto comprende dos etapas: en la primera, de base documental, pretendemos finalizar con la tarea iniciada en la investigación arriba mencionada con el fin de delimitar y establecer un corpus que incluya el conjunto de los textos gramaticales producidos en la Argentina durante el período considerado. Como resultado de esta etapa, aspiramos a elaborar un catálogo de las gramáticas escolares publicadas entre 1863 y 1922, que comprenda también la edición digital de las más representativas. Esta fase servirá como insumo de una segunda etapa, analítica e interpretativa, que buscará determinar de qué modo se ha configurado la reflexión gramatical en el ámbito escolar argentino.En el ámbito de la historiografía lingüística hispánica, existen numerosas investigaciones sobre la gramaticografía didáctica decimonónica. No obstante, la mayor parte de ellas se ha ocupado de abordar obras o autores particulares, mientras que todavía existen pocos estudios que aporten una perspectiva más amplia sobre un período determinado o sobre un conjunto específico de autores. Esta desatención redunda en un desconocimiento de numerosos aspectos de la historia gramatical y escolar argentina que podrían resultar determinantes para la comprensión global de muchos fenómenos actuales, tanto en el campo de la lingüística como en el de la didáctica de la lengua. Estudios recientes demuestran que las ideas gramaticales contenidas en los manuales escolares han producido importantes beneficios a la lingüística contemporánea; por ejemplo, el de servir de transmisoras de la ?alta? producción teórico-científica que se desarrolla en el seno de las diferentes corrientes lingüísticas.A partir de esta perspectiva, esperamos que nuestra investigación aporte a la recuperación documental de la tradición gramatical, contribuya a determinar el modo en que esta se interrelaciona con las teorías lingüísticas contemporáneas y se constituya en un aporte a la reflexión sobre las prácticas actuales de la enseñanza de la lengua.",Facultad de Filosofía y Letras; Universidad de Buenos Aires,2018,2020,S/D,20020170200203BA
"Didáctica del latín, ayer y hoy: contextos, actores, métodos, materiales","Ventura, Mariana",S/D,vigente,UBACYT,"Proponemos una investigación sobre didáctica específica del latín, cuyo objetivo general consistirá en ampliar nuestros conocimientos acerca de los variados métodos de enseñanza empleados hasta el presente y en desarrollar criterios válidos tanto para seleccionar los más adecuados a distintos contextos de aplicación, como para diseñar nuevas estrategias didácticas. A fin de cumplir este objetivo general, abordaremos la cuestión desde un punto de vista histórico, comparando las condiciones en las que se enseñaba y aprendía latín en el pasado ?especialmente en la Antigüedad, pero también en la Edad Media y el Renacimiento? con las condiciones en las que se lo hace hoy en día en la Argentina y en otros lugares del mundo. El análisis se centrará en los diferentes contextos educativos de la práctica docente, en los actores intervinientes en el proceso de enseñanza-aprendizaje, en los métodos de enseñanza empleados y en los materiales didácticos correspondientes.",Facultad de Filosofía y Letras; Universidad de Buenos Aires,2018,2020,S/D,20020170100083BA
