Título,Director,Integrantes,Estado,Tipo de proyecto,Descripción,Institución,Fecha de inicio,Fecha de finalización,Enlace,Código
Derivas de la materia de Bretaña: su relevancia en la configuración de la primera ficción caballeresca europea (siglos XII y XIII),"Artal, Susana - Amor, Lidia","Balestrini, María Cristina- Basarte, Ana - Dumas, María - Aldazabal, Ana - Gómez, Mariana - Fernández Riva, Gustavo - Pelegrí, Emily - Fernández, Karina - Vieira, María Florencia - Yankelevich, Kaila",vigente,UBACYT,"El objetivo general de este proyecto es abrir una reflexión que permita reevaluar el desarrollo de la narrativa caballeresca europea, desde el último cuarto del siglo XII hasta fines del XIII, haciendo eje en un corpus textual que no ha sido atendido por el medievalismo internacional de manera comparada y que constituye un área por completo vacante en el ámbito local. En efecto, si bien el período considerado, que se extiende desde la etapa inaugural del desarrollo del roman caballeresco en verso hasta la emergencia de la prosa literaria en lengua vernácula y la constitución de los extensos ciclos en prosa, ha sido objeto privilegiado en la indagación de la crítica especializada, la atención centrada en las líneas hegemónicas de la producción textual de esa etapa no solo ha relegado el estudio de textos como los que nos proponemos estudiar, que, por razones de diversa índole, ocupan un lugar periférico con respecto a la corriente que predominó en la evolución ulterior de esa narrativa, sino que ha restringido la perspectiva de estudio al conceder poca atención a sus vínculos intertextuales y considerarlos en general de modo aislado, sin evaluar la incidencia de esas obras más allá de sus espacios de origen. Con esa meta, se ha seleccionado para este nuevo proyecto un corpus que, al mismo tiempo que respeta los límites cronológicos y lingüísticos acordes al objeto general de la investigación y a las posibilidades materiales de explorarlo en los plazos fijados para este proyecto, constituye en nuestra opinión una muestra significativa de la heterogeneidad y la riqueza de esa producción ya que incluye textos producidos en momentos diferentes dentro del período considerado (fines del siglo XII, mediados y fines del XIII), en Francia (Le Bel Inconnu, de Renaud de Beaujeu, y L’âtre périlleux), Alemania (Iwein, de Hartmann von Aue) e Inglaterra (Sir Tristrem), es decir, los tres focos principales de difusión de la materia de Bretaña. Creemos que las conclusiones a que pueda arribarse a partir del estudio de esta muestra deberían proporcionar instrumentos adecuados para abordar, en otros proyectos, más obras que respondan a las características de las que integran el corpus seleccionado para este plan. 

","Instituto de Filología y Literatura Hispánica ""Dr. Amado Alonso""; Facultad de Filosofía y Letras; Universidad de Buenos Aires;",2018,2020,http://iflh.institutos.filo.uba.ar/proyecto/derivas-de-la-materia-de-breta%C3%B1a-su-relevancia-en-la-configuraci%C3%B3n-de-la-primera-ficci%C3%B3n,20020170100497BA
El desarrollo de las publicaciones del Instituto de Filología en sus cien años de historia. Sistematización e interpretación críticas. Primera etapa (1923-1973)," Battista, Emiliano","Baico, Leticia- Chirino, Faustino- Vázquez, Laura",vigente,UBACYT,"El presente trabajo tiene como objeto reunir y sistematizar, a la luz de una presentación e interpretación críticas del desarrollo de cada una de ellas, las diferentes publicaciones (boletines, cuadernos, colecciones, bibliotecas, revistas, etc.) impulsadas por los responsables del Instituto de Filología y Literaturas Hispánicas ""Dr. Amado Alonso"" en sus cien años de historia. Dentro de esta dimensión temporal, establecemos dos etapas, coherentemente consignadas como fases suvesivas de (dos) proyectos de investigación. Proponemos como desarrollo del presente plan el abordaje de la primera etapa, que abarca los años comprendidos entre 1923 y 1973. Nuestro trabajo tiene una finalidad doble: por un lado, realizar una obra documental y analítica que sistematice las publicaciones del Instituto, poniendo en valor su patrimonio histórico y proveyendo de ese insumo a futuras investigaciones; por otro, contribuir con la interpretación del desarrollo de las ideas lingüísticas en Argentina, basándonos en el análisis de los distintos modelos teórico-metodológicos subyacentes a los proyectos editoriales que se fueron verificando en tan señero centro de estudios lingüísticos del mundo hispánico. Nuestro marco teórico es el de la Historiografía lingüística y buscamos enriquecerlo con los aportes de la Glotopolítica. En la conformación de nuestro equipo de trabajo se destaca la interdisciplinariedad, dado que entre el Director y sus miembros (graduados y estudiantes) logran nuclearse los estudios de Letras, Historia, Edición, Bibliotecología y Archivología. ","Instituto de Filología y Literatura Hispánica ""Dr. Amado Alonso""; Facultad de Filosofía y Letras; Universidad de Buenos Aires;",2018,2019,http://iflh.institutos.filo.uba.ar/proyecto/el-desarrollo-de-las-publicaciones-del-instituto-de-filolog%C3%ADa-en-sus-cien-a%C3%B1os-de-historia,20020170200039BA
"Escritura, multimodalidad y prácticas de enseñanza: dispositivos y estrategias en la formación docente en Letras"," Bombini, Gustavo","Labeur, Paula- Fernández, Mirta - Colussi, Romina - López, Claudia - Bibbó, Mónica - D'Agostino, Mariana - Cozzi, Soledad - Galán, Ignacio - Sorrentino, Florencia",vigente,UBACYT,En la investigación anterior partimos de la experiencia acumulada en la Cátedra de Didáctica Especial y Prácticas de la Enseñanza en Letras en la formación de profesores en Letras referida a las prácticas de escritura posibles para la planificación y el análisis de las prácticas docentes en escuela medias y en espacios de educación no formal. Esa experiencia ha permitido ensayar distintos tipos de escrituras de las prácticas que han impactado de manera productiva en la su construcción y en la calidad de reflexión sobre la experiencia de enseñanza. Ahora nuestra hipótesis es que las practicas de lectura y escritura en contextos de multimodalidad nos brindarán nuevos modos de comprender las relaciones con la cultura escrita y con el conocimiento en los espacios de enseñanza.,"Instituto de Filología y Literatura Hispánica ""Dr. Amado Alonso""; Facultad de Filosofía y Letras; Universidad de Buenos Aires;",2016,2018,http://iflh.institutos.filo.uba.ar/proyecto/escritura-multimodalidad-y-pr%C3%A1cticas-de-ense%C3%B1anza-dispositivos-y-estrategias-en-la,20020150100144BA
"Enfoque cognitivo-prototípico y Enseñanza de la lengua: Gramática y Fonética/Fonología - Nominales, Cláusulas y Marcadores","Borzi, Claudia Beatriz","Roseti, Laura Patricia- Regueira, Inés Elena  -  Morón Usandivaras, Mariana - García Jurado, María Amalia - González, María Susana - Otero, Ana Maria Amanda - Peri, Silvina Andrea - Delmas, Ana María - Insirillo, Patricia Alejandra - Trípodi, Mónica Noemí - Martínez, Rocío Anabel - Hernández, Patricia Carmen - Funes, María Soledad - Poggio, Anabella Laura - Romero, María Cecilia - Yuvero, Ana Cristina - Nerguizian, Alicia Beatriz - González, María Susana",vigente,UBACYT,"El presente Proyecto está enmarcado en el Enfoque Cognitivo Prototípico (Lakoff 1987 y Langacker 1987) que sostiene la emergencia de la gramática desde el discurso y la motivación total o parcial del signo; presupuestos que, en comparación con las propuestas hechas desde otros puntos de partida teóricos, abren nuevas posibilidades descriptivas para solucionar viejos problemas. Como continuación de proyectos anteriores se basa, especialmente, en antecedentes del mismo Equipo. En coherencia con estos resultados anteriores, partiendo de la estructura del discurso, se describen fenómenos gramaticales y prosódicos con el objetivo general de aportar evidencia a la influencia de fenómenos de orden pragmático y semántico, sobre los aspectos gramaticales y sonoros. Se estudian en particular: La estructura interna del nominal; la constitución de cláusulas y la conceptualización de verbos; así como la combinación de cláusulas por medio de conectores y de marcadores discursivos. El tratamiento de las relaciones sintácticas y de los conectores y marcadores busca falsar o aportar datos empíricos a las hipótesis generales de Borzi 1995 y 2001. Se comparan contrastivamente español/inglés y español/francés. Se sigue una metodología cualitativa y cuantitativa. En particular, se analizan datos del español de Buenos Aires recolectados en el marco de los proyectos PRESEEA y de La Norma Culta. Para los estudios fonético/fonológicos se trabaja sobre cuerpos de datos leídos y naturales, y se utilizan los programas Anagraf, Praat y Wavesurfer. Se hacen pruebas perceptivas. Siguiendo las propuestas de Borzi 2000 y 2011, se contemplan aspectos pedagógicos para llevar los resultados a la enseñanza de la lengua en el aula (español, inglés, francés). Se busca a su vez, por un lado, promover estudios sobre el español desde el enfoque elegido y, por otro, seguir desarrollando la Asociación Argentina de Lingüística Cognitiva.",Instituto de Lingüística; Facultad de Filosofía y Letras; Universidad de Buenos Aires;,2018,2020,http://il.institutos.filo.uba.ar/proyecto/enfoque-cognitivo-protot%C3%ADpico-y-ense%C3%B1anza-de-la-lengua-gram%C3%A1tica-y-fon%C3%A9ticafonolog%C3%ADa,20020170100583BA
"Hagiografía, biografía y narración: las versiones griegas mixta, incierta y abreviada y las versiones latinas de la Vida de Juan el limosnero","Cavallero, Pablo",S/D,vigente,UBACYT,"El proyecto es continuación de un alínea de investigación consolidada, centrada en la edición de textos griegos medievales y sus vinculados, con un enfoque interdiciplinario. Se propone: 1.Editar, traducir y anotar las versiones inéditas que llamamos ?mixta? (ms. Vaticanus graecus 808, 121-144 = R), ?incierta? (ms. Vaticanus Ottobonianus graecus 1, 54-61 = &#934;) y ?abreviada? (ms. Vaticanus graecus 807, 100-117 = Q; ms. Vaticanus graecus 544, 148-202 = W).2.Editar, traducir y anotar las traducciones latinas anónimas de la VJL contenidas en los mss. Napoli, Bibl. Naz., Vindob. lat. 15 (olim Wien, ÖNB, lat. 739), ff. 184-197v, a. 1174, y Paris, B.N., lat. 3820, ff. 166v-175 (olim CLXXXVIIv-CXCVI), ss. XIII-XIV.3.Editar y estudiar el apartado sobre Juan el Limosnero que figura en el Liber illustrium personarum de Juan Gil de Zamora que todavía está inédito, Burgo de Osma, Archivo Capitular, ms. 18.",Facultad de Filosofía y Letras; Universidad de Buenos Aires,2018,2020,S/D,20020170100057BA
Los territorios comparatistas: Literaturas nacionales/Regiones culturales/Literaturas extranjeras/Límites. La comparación como metodología y disciplina," Cella, Susana","Alazraki, RuthAlonso, Diego - Candiano, Leonardo - Da Ré, Esteban  - Fernández Arca, Marta - García, Victoria - González, Alejandro - Lobos, Omar - López Arriazu, Eugenio - Márquez, Joaquín - Sarachu, Julia - Siles, Eduardo - Ybañes, Roxana",vigente,UBACYT,"El presente proyecto estudia los modos de comparación y examina los diferentes enfoques que se han dado y dan a ellos a fin de indagar en su status como disciplina y como metodología. En tanto teoría literaria, la literatura comparada propicia vinculaciones entre textos de diferentes épocas y culturas, despliega las relaciones entre lenguas y entre traducciones, permite diseñar redes a nivel intranacional, intra-subcontinental, transcontinental y transepocal. A lo que se agregan las posibilidades comparativas trans-artísticas y transdisciplinares no sólo entre disciplinas humanísticas (filosofía, psicología, historia, sociología) sino también respecto de otros saberes o creencias (ciencia, política, religión, economía), y otras prácticas sociales y culturales. Los textos literarios son susceptibles de entrar en sistemas comparativos a partir del diseño de una base de comparación sustentada en rasgos relevantes que permitan diseñarla. Prestamos atención dentro de las formas traslativas a las categorías signadas por el prefijo ?trans-? (transculturación, transdisciplinariedad, traducción, estudios transatlánticos, transmodernidad, entre otros), y sostenemos la posibilidad de emplear metodologías y referencias teóricas varias, siempre acordes y pertinentes para cada propuesta comparativa. Al considerar lo atinente al trabajo comparativo implicamos la pregunta por su lugar como disciplina entre las que integran ?y se pueden vincular con ella- los estudios literarios. Esto lleva a considerar corrientes interpretativas del hecho literario en una dimensión diacrónico-sincrónica y su revisión crítica. Tenemos en cuenta en estos aspectos los estudios comparados en ámbitos institucionales del país y el exterior como desarrollo y derroteros de la literatura comparada, Al estudiar distintas formas de comparatismo sostenemos la autonomía literaria como premisa para encarar los varios enfoques. En la dimensión comparativa intraliteraria, incorporamos dentro del campo literario específico el estudio comparado de los procedimientos, de los problemas de la traducción; el estudio de la influencia y de la imitación, de la recepción y el efecto; la periodización histórico-literaria; la comparación de géneros, formas, temas. Al considerar este complejo entramado vinculado con la tradición comparatista y según las metodologías y teorías implicadas, se busca aportar a los estudios sobre lo que denominamos los territorios de la comparación y fundamentar su estatus disciplinar.","Instituto de Filología y Literatura Hispánica ""Dr. Amado Alonso""; Facultad de Filosofía y Letras; Universidad de Buenos Aires;",2018,2020,http://iflh.institutos.filo.uba.ar/proyecto/los-territorios-comparatistas-literaturas-nacionalesregiones-culturalesliteraturas,20020170100360BA
"Documentación y estudio del arte verbal en lenguas de América del Sur: Temas de fonología, sintaxis y discurso","Ciccone, Florencia","Krojzl, Juan; Baranger, Estefanía -  Pacor, Paola -  Rodríguez, Mariana Lila - Juanatey, Mayra Ayelén - Golluscio, Lucía - Gutiérrez, Analía -  Durante, Santiago Gabriel -  Murata Missagh, Julieta - Califa, Martín",vigente,UBACYT,"En el marco de los avances recientes en lingüística de la documentación y estudios del arte verbal, el presente proyectopropone el registro, sistematización y análisis de distintas expresiones de la tradición oral y el acervo discursivoproducido y reactualizado por hablantes de las siguientes lenguas de América del Sur: ayoreo (zamuco); aché, guaraníparaguayo, tapiete (tupí-guaraní); chorote, nivaclé (mataco-mataguaya), quichua santiagueño, quechua cuzqueñoboliviano (quechua) y mapudungun (aislada). La investigación adopta los aportes más recientes de la lingüística de la documentación y los desarrollos teóricos-metodológicos de los estudios sobre arte verbal y literatura oral producidosen el marco de la lingüística antropológica. Asimismo, a partir de la posibilidad de crear bases de datos discursivosque permitan comparaciones translingüísticas de las lenguas bajo estudio, se busca profundizar en temas de fonologíay morfosintaxis relacionados con el discurso desde una perspectiva tipológico-funcional. El arte verbal constituyeun acto de lenguaje creativo que apela tanto a la tradición y a la memoria como al presente y al futuro de los pueblos, proponiendo nuevos significados, construyendo nuevos contextos y reforzando o resignificando las identidades.Estas manifestaciones orales cumplen un rol central en la transmisión de las lenguas y cosmovisiones originarias,pero también en la configuración de formas de expresión innovadoras. Por permitir el despliegue de recursos yrepertorios lingüísticos variados, se constituyen en muestras interesantes de las posibilidades discursivas, gramaticalesy fonológicas de las lenguas pero también de las relaciones dinámicas entre lengua, cultura y sociedad.",Instituto de Lingüística; Facultad de Filosofía y Letras; Universidad de Buenos Aires;,2018,2020,http://il.institutos.filo.uba.ar/proyecto/documentaci%C3%B3n-y-estudio-del-arte-verbal-en-lenguas-de-am%C3%A9rica-del-sur-temas-de-fonolog%C3%ADa,20020170200380BA
"Agendas, léxicos y conceptos en la crítica literaria latinoamericana","Colombi, Beatriz",S/D,vigente,UBACYT,"El presente proyecto titulado ""Agendas, léxicos y conceptos en la crítica literaria latinoamericana"" sepropone reflexionar sobre las agendas críticas vigentes en las últimas décadas en esta disciplina a partir del estudio de sus léxicos especializados y conceptos críticos presentes en diccionarios de términos y ensayos, desde una perspectiva situada en nuestro ámbito y en diálogo con las producciones de otros espacios académicos. El permanente flujo que experimenta el lenguaje especializado en una academia cada vez másglobalizada tiende a pasar por alto los determinantes concretos de cada lugar específico de producción. En este proyecto nos proponemos relevar estas diferentes agendas de la crítica en la literatura latinoamericana de acuerdo a su específico lugar académico de emergencia y sus usos léxicos y conceptuales, dando especialrelevancia a los debates y perspectivas más recientes, con el objeto de promover la generación de conocimiento innovador y original en este campo.",Instituto de Literatura Hispanoamericana; Facultad de Filosofía y Letras; Universidad de Buenos Aires,2018,2020,S/D,20020170100276BA
Metáforas en el texto y en el léxico: aspectos de teoría y descripción,"Ciapuscio, Guiomar Elena - Adelstein, Andreína","Arellano, Nicolás A.- Arias, Marcelo D. -  Battista, Emiliano - Berri, Marina - Bregant, Lucía A. - Coco, Victoria - Gallardo,
Susana - Glozman, Mara R. -  Migdalek, Maia J. -  Nercesián, Verónica - Straccia, Julieta R.
",vigente,UBACYT,"Este proyecto continúa las investigaciones en curso del equipo, que toman como objeto empírico diferentes áreas disciplinares, enfocadas desde una perspectiva teórico-descriptiva y, subsidiariamente, didáctico-aplicada. El proyecto se centra en la metáfora, en su dimensión léxico-textual y discursiva, por un lado, y en su dimensión estrictamente léxica, como mecanismo fundamental de la polisemia y la creatividad léxica, por el otro. Por otra parte, durante el proyecto el equipo de cátedra planea completar la escritura y edición de un manual para la enseñanza universitaria de la disciplina Lingüística, tarea que representa la labor principal de transferencia, cuya primera etapa de elaboración conceptual ha sido completada en el proyecto UBACYT previo.",Facultad de Filosofía y Letras; Universidad de Buenos Aires,2018,2020,S/D,20020170100214BA
El intelectual humanista y los saberes en el Renacimiento,"Ciorda, Martín - Sforza, Nora","Sverlij, Mariana - Lorenzatti, Mariana - Hoyos Hattori, Paula - Waitoller, Gustavo - Sueiro, Lucas - Zaldívar, Ágata",vigente,UBACYT,"El objetivo del presente proyecto es pensar la cuestión de los intelectuales humanistas y los saberes en el Renacimiento, a partir de una serie de casos que van desde el siglo XV al XVII, situados en Italia, Inglaterra, Portugal y España.","Instituto de Filología y Literatura Hispánica ""Dr. Amado Alonso""; Facultad de Filosofía y Letras; Universidad de Buenos Aires;",2017,2019,http://iflh.institutos.filo.uba.ar/proyecto/el-intelectual-humanista-y-los-saberes-en-el-renacimiento,20020160100035BA
Morfosintaxis griega: corpus para la enseñanza de Griego clásico,"Coscolla, María José",S/D,vigente,UBACYT,El objeto del presente proyecto es la construcción de un corpus graduado para la enseñanza del griego clásico en contextos universitarios y de educación superior con el apoyo de TICS. Esto implica una revisión y puesta en cuestionamiento de los contenidos y metodologías aplicadas en el pasado y en la actualidad de modo que el proceso de enseñanza-aprendizaje sea más eficaz para un alumnado inserto en una cultura preponderantemente visual.,Facultad de Filosofía y Letras; Universidad de Buenos Aires,2018,2020,S/D,20020170100763BA
"Traducir, interpretar, 'transpensar'. Leer a Homero en el español hispanoamericano del siglo XXI (continuación)","Crespo, María José",S/D,vigente,UBACYT,"El presente plan (continuación del proyecto UBACYT anterior) plantea la elaboración conjunta de una edición bilingüe del texto de la Ilíada, con estudios preliminares, fijación del texto, traducción, notas, comentario y apéndices. El resultado co...",Facultad de Filosofía y Letras; Universidad de Buenos Aires,2017,2019,S/D,20020160100125BA
"Dinero y Literatura en el siglo XIX. Conceptos, representaciones, prácticas.","Cristófalo, Américo",S/D,vigente,UBACYT,"El proyecto se propone estudiar las relaciones entre dinero y literatura en el siglo XIX europeo.Proponemos tres campos conceptuales. El primero se propone explorar la historia y el concepto del dinero en el siglo XIX; el segundo trabaja con los sistemas de representación en la literatura del período; y el tercero, las relaciones entre la institución literaria y el dinero. Se explorará la historia y el concepto de dinero en el siglo XIX mediante un recorrido por las teorías económicas clásicas, sus efectos y transformaciones críticas en el siglo XIX, los conceptos de economía política, de mercancía, de capital, de intercambio. Durante el siglo XIX las disciplinas económicas conciben el dinero no solo como valor en sí sino como mercancía que cumple la función de equivalente general. A partir del pasaje a formas desarrolladas de capitalismo, el dinero, entendido como mercancía, oculta relaciones económicas de producción y de creación de valor. En su condición de equivalente general, alrededor suyo se generan fetichismos, idealizaciones, mitologizaciones que constituirán el fundamento moderno de su vínculo con la dimensión imaginaria de la literatura. En el segundo campo se estudiarán diversas representaciones del dinero en las poéticas del siglo XIX: el idealismo romántico, que reacciona frente al capitalismo apelando a un imaginario pastoral vinculado con la teorías fisiocráticas (Rousseau, Wordsworth); las poéticas realistas, que privilegian las representaciones de la industria, del comercio y la ciudad, y que construyen representaciones de la función del dinero como equivalente general, asociándolo al complejo mundo de la mercancía (Balzac); y las poéticas de fin de siglo (Flaubert, Zola, Leon Bloy), en las que la figura del dinero se vuelve objeto de impugnación radical de la dominación burguesa, y aun de la dominación imperialista ascendente vinculada a la expansión financiera del capital (Conrad). En cuanto al tercer campo, el proyecto se propone dar cuenta de la consolidación del mercado literario a partir de los fenómenos de crecimiento, de generalización de los efectos de la prensa y de la opinión pública, ya configurados en el siglo XVIII. El proyecto se propone estudiar el impacto sobre la constitución de las poéticas decimonónicas y sobre las relaciones conflictivas del dinero en la construcción de las figuras de escritor.",Facultad de Filosofía y Letras; Universidad de Buenos Aires,2018,2019,S/D,20020170100440BA
Historias comparadas de la literatura argentina y brasileña -2da parte,"Croce, Marcela",S/D,vigente,UBACYT,El plan de trabajo está organizado a lo largo de dos grandes períodos de las historias argentina y brasileña: 1889 a 1955 y 1955 a 2013. Este segmento apunta a dar continuidad a lo abordado en el proyecto UBACyT 2013-2016 (plasmado en dos tomos que a...,Facultad de Filosofía y Letras; Universidad de Buenos Aires,2017,2019,S/D,20020160100014BA
